{
  "id": "jarvis-approved-tool-adapters",
  "pj": "PJ42.4",
  "version": "1.0.0",
  "adapters": [
    {
      "adapter_id": "dialogue_brain",
      "label": "Dialogue Brain",
      "family": "dialogue",
      "description": "Handles normal Commander dialogue, reasoning, explanations, and safe non-tool answers.",
      "allowed_commands": ["ASK_GENERAL"],
      "risk_level": "safe_read",
      "approval_required": false,
      "evidence_required": true,
      "read_only": true,
      "live_data_capable": false,
      "output_surfaces": ["jarvis_hud", "dialogue_card"],
      "timeout_ms": 30000,
      "failure_fallback": "Return a safe explanation that the dialogue brain could not complete and suggest a more specific question.",
      "requires_source_confidence": false,
      "requires_policy_gate": false
    },
    {
      "adapter_id": "web_research_adapter",
      "label": "Live Web Research Adapter",
      "family": "live_research",
      "description": "Retrieves current public information and source trails for unstable facts.",
      "allowed_commands": ["LIVE_RESEARCH"],
      "risk_level": "safe_read",
      "approval_required": false,
      "evidence_required": true,
      "read_only": true,
      "live_data_capable": true,
      "output_surfaces": ["jarvis_hud", "source_confidence_card", "evidence_drawer"],
      "timeout_ms": 60000,
      "failure_fallback": "State that live verification failed and provide the safest known answer without pretending it is current.",
      "requires_source_confidence": true,
      "requires_policy_gate": false
    },
    {
      "adapter_id": "kingsmen_knowledge_adapter",
      "label": "Kingsmen Knowledge Adapter",
      "family": "kingsmen_knowledge",
      "description": "Searches approved Kingsmen doctrine, architecture, pricing, workflow, and build knowledge.",
      "allowed_commands": ["SEARCH_KINGSMEN_KNOWLEDGE"],
      "risk_level": "safe_read",
      "approval_required": false,
      "evidence_required": true,
      "read_only": true,
      "live_data_capable": false,
      "output_surfaces": ["jarvis_hud", "knowledge_card", "evidence_drawer"],
      "timeout_ms": 45000,
      "failure_fallback": "State that Kingsmen knowledge lookup failed and answer only from visible context.",
      "requires_source_confidence": true,
      "requires_policy_gate": false
    },
    {
      "adapter_id": "github_adapter",
      "label": "GitHub Repo Inspection Adapter",
      "family": "repo_inspection",
      "description": "Inspects approved GitHub repository files, issues, commits, and build evidence.",
      "allowed_commands": ["GITHUB_REPO_INSPECT"],
      "risk_level": "safe_read",
      "approval_required": false,
      "evidence_required": true,
      "read_only": true,
      "live_data_capable": true,
      "output_surfaces": ["jarvis_hud", "repo_card", "evidence_drawer"],
      "timeout_ms": 45000,
      "failure_fallback": "State that repo inspection failed and do not guess file or issue state.",
      "requires_source_confidence": true,
      "requires_policy_gate": false
    },
    {
      "adapter_id": "system_health_adapter",
      "label": "System Health Adapter",
      "family": "system_health",
      "description": "Checks approved health endpoints and returns safe system status summaries.",
      "allowed_commands": ["SYSTEM_STATUS"],
      "risk_level": "safe_read",
      "approval_required": false,
      "evidence_required": true,
      "read_only": true,
      "live_data_capable": true,
      "output_surfaces": ["jarvis_hud", "system_health_panel"],
      "timeout_ms": 30000,
      "failure_fallback": "Return health-check failure and next safe diagnostic step.",
      "requires_source_confidence": false,
      "requires_policy_gate": false
    },
    {
      "adapter_id": "validation_adapter",
      "label": "Validation Adapter",
      "family": "validation_build",
      "description": "Runs or prepares approved validators and returns proof, failures, and repair direction.",
      "allowed_commands": ["VALIDATE_PHASE"],
      "risk_level": "approval_required",
      "approval_required": true,
      "evidence_required": true,
      "read_only": false,
      "live_data_capable": false,
      "output_surfaces": ["jarvis_hud", "validation_card", "approval_modal", "evidence_drawer"],
      "timeout_ms": 120000,
      "failure_fallback": "Return validator failure and repair path without claiming phase completion.",
      "requires_source_confidence": false,
      "requires_policy_gate": true
    },
    {
      "adapter_id": "build_adapter",
      "label": "Build Adapter",
      "family": "validation_build",
      "description": "Runs approved build checks and summarizes success, failure, and repair path.",
      "allowed_commands": ["RUN_WEB_BUILD"],
      "risk_level": "approval_required",
      "approval_required": true,
      "evidence_required": true,
      "read_only": false,
      "live_data_capable": false,
      "output_surfaces": ["jarvis_hud", "build_card", "approval_modal", "evidence_drawer"],
      "timeout_ms": 180000,
      "failure_fallback": "Return build failure and repair path; do not modify code inside build command.",
      "requires_source_confidence": false,
      "requires_policy_gate": true
    },
    {
      "adapter_id": "postgres_read_model_adapter",
      "label": "PostgreSQL Read Model Adapter",
      "family": "database_read_model",
      "description": "Reads only approved operational summaries and never raw private rows.",
      "allowed_commands": ["POSTGRES_READ_MODEL_SCAN"],
      "risk_level": "safe_read",
      "approval_required": false,
      "evidence_required": true,
      "read_only": true,
      "live_data_capable": true,
      "output_surfaces": ["jarvis_hud", "database_summary_card", "evidence_drawer"],
      "timeout_ms": 45000,
      "failure_fallback": "Return database summary failure and recommend safe read-model repair.",
      "requires_source_confidence": false,
      "requires_policy_gate": true
    },
    {
      "adapter_id": "playwright_scout_adapter",
      "label": "Playwright Scout Adapter",
      "family": "playwright_scout",
      "description": "Scouts approved pages for reachability, blockers, screenshots, and manual fallback evidence.",
      "allowed_commands": ["PLAYWRIGHT_PORTAL_HEALTH"],
      "risk_level": "approval_required",
      "approval_required": true,
      "evidence_required": true,
      "read_only": false,
      "live_data_capable": true,
      "output_surfaces": ["jarvis_hud", "portal_scout_card", "approval_modal", "evidence_drawer"],
      "timeout_ms": 120000,
      "failure_fallback": "Return blocker/failure evidence and recommend manual fallback; do not bypass blockers.",
      "requires_source_confidence": true,
      "requires_policy_gate": true
    },
    {
      "adapter_id": "report_generation_adapter",
      "label": "Report Generation Adapter",
      "family": "report_generation",
      "description": "Generates Founder-facing reports, summaries, digests, and reviewable plans.",
      "allowed_commands": ["GENERATE_FOUNDER_DIGEST"],
      "risk_level": "safe_generate",
      "approval_required": false,
      "evidence_required": true,
      "read_only": true,
      "live_data_capable": true,
      "output_surfaces": ["jarvis_hud", "digest_card", "evidence_drawer"],
      "timeout_ms": 60000,
      "failure_fallback": "Generate a partial digest and mark missing evidence clearly.",
      "requires_source_confidence": true,
      "requires_policy_gate": false
    },
    {
      "adapter_id": "evidence_pack_adapter",
      "label": "Evidence Pack Adapter",
      "family": "report_generation",
      "description": "Generates reviewable evidence packs from approved evidence trails.",
      "allowed_commands": ["GENERATE_EVIDENCE_PACK"],
      "risk_level": "review_required",
      "approval_required": true,
      "evidence_required": true,
      "read_only": true,
      "live_data_capable": false,
      "output_surfaces": ["jarvis_hud", "evidence_pack_card", "evidence_drawer"],
      "timeout_ms": 60000,
      "failure_fallback": "Return partial evidence pack and list missing proof.",
      "requires_source_confidence": true,
      "requires_policy_gate": true
    },
    {
      "adapter_id": "approval_adapter",
      "label": "Approval Flow Adapter",
      "family": "approval_flow",
      "description": "Creates Commander approval requests for risky commands.",
      "allowed_commands": ["REQUEST_APPROVAL"],
      "risk_level": "review_required",
      "approval_required": true,
      "evidence_required": true,
      "read_only": false,
      "live_data_capable": false,
      "output_surfaces": ["jarvis_hud", "approval_modal"],
      "timeout_ms": 30000,
      "failure_fallback": "If approval cannot be created, keep the action blocked.",
      "requires_source_confidence": false,
      "requires_policy_gate": true
    },
    {
      "adapter_id": "blocked_adapter",
      "label": "Blocked Adapter",
      "family": "blocked",
      "description": "Handles explicitly blocked commands by refusing the action and redirecting to a safe Kingsmen workflow.",
      "allowed_commands": ["SEND_EXTERNAL_MESSAGE", "MAKE_PAYMENT_DECISION", "SUBMIT_OFFICIAL_APPLICATION_SILENTLY"],
      "risk_level": "blocked",
      "approval_required": true,
      "evidence_required": true,
      "read_only": true,
      "live_data_capable": false,
      "output_surfaces": ["jarvis_hud", "blocked_card", "safe_redirect_card"],
      "timeout_ms": 1000,
      "failure_fallback": "Keep command blocked and state safe alternative.",
      "blocked_reason": "Blocked commands cannot be routed to active operational tools.",
      "requires_source_confidence": false,
      "requires_policy_gate": true
    }
  ]
}
